{
  "type": "timeline",
  "version": "1.0.0",
  "id": "timeline-independence",
  "metadata": { "title": "Indian independence — key events" },
  "purpose": { "learningObjective": "Explore major events in chronological order", "reasoningMode": "sequence" },
  "content": {
    "kind": "events",
    "events": [
      { "id": "event-1757", "label": "Battle of Plassey", "date": "1757" },
      { "id": "event-1857", "label": "1857 uprising", "date": "1857" },
      { "id": "event-1885", "label": "Congress founded", "date": "1885" },
      { "id": "event-1919", "label": "Jallianwala Bagh", "date": "1919-04-13" },
      { "id": "event-1930", "label": "Salt March", "date": "1930-03-12" },
      { "id": "event-1942", "label": "Quit India", "date": "1942-08-08" },
      { "id": "event-1947", "label": "Independence", "date": "1947-08-15", "links": { "visualEntityId": "figure-independence" } }
    ],
    "periods": [
      { "id": "period-company", "label": "Company rule", "from": "1757", "to": "1858", "style": { "role": "secondary-period" } },
      { "id": "period-crown", "label": "British Raj", "from": "1858", "to": "1947", "style": { "role": "primary-period" } }
    ],
    "tracks": [
      { "id": "track-movement", "label": "National movement", "events": ["event-1857", "event-1919", "event-1930", "event-1942", "event-1947"] },
      { "id": "track-reform", "label": "Constitutional reform", "events": ["event-1885"] }
    ]
  },
  "interaction": { "mode": "explore", "actions": ["select", "deselect", "focus", "play-pause", "step", "scrub", "reset"] },
  "questions": [],
  "sources": [{ "class": "authoritative", "title": "Historical records" }],
  "accessibility": { "label": "Timeline of Indian independence movements and constitutional reform." }
}