{
  "type": "timeline",
  "version": "1.0.0",
  "id": "skill-example-independence",
  "metadata": {
    "title": "Indian independence — key events"
  },
  "purpose": {
    "learningObjective": "Compare the pace of revolt and constitutional reform",
    "reasoningMode": "sequence"
  },
  "content": {
    "kind": "events",
    "events": [
      {
        "id": "event-1857",
        "label": "1857 uprising",
        "date": "1857"
      },
      {
        "id": "event-1919",
        "label": "Jallianwala Bagh",
        "date": "1919-04-13"
      },
      {
        "id": "event-1947",
        "label": "Independence",
        "date": "1947-08-15",
        "links": {
          "visualEntityId": "figure-independence"
        }
      }
    ],
    "periods": [
      {
        "id": "period-company",
        "label": "Company rule",
        "from": "1757",
        "to": "1858",
        "description": "East India Company administration",
        "style": {
          "role": "secondary-period"
        }
      }
    ],
    "tracks": [
      {
        "id": "track-movement",
        "label": "National movement",
        "events": [
          "event-1857",
          "event-1947"
        ]
      },
      {
        "id": "track-reform",
        "label": "Constitutional reform",
        "events": [
          "event-1919"
        ]
      }
    ]
  },
  "interaction": {
    "mode": "explore",
    "actions": [
      "select",
      "deselect",
      "focus",
      "play-pause",
      "step",
      "scrub",
      "reset"
    ]
  },
  "questions": [],
  "sources": [
    {
      "class": "authoritative"
    }
  ],
  "accessibility": {
    "label": "Timeline of Indian independence movements and constitutional reform."
  }
}
